create table message (id int primary key, text varchar(10)) softdelete retention 7 day;
set @@tidb_translate_softdelete_sql = true;
insert into message values (1, '24h'), (2, '24h'), (3, '1h'), (4, '1h');
delete from message where id = 1;
update message set text = 'new' where text = '24h';
select * from message order by id;
id	text
2	new
3	1h
4	1h
set @@tidb_translate_softdelete_sql = false;
select id, text, _tidb_softdelete_time is not null as is_deleted from message where id = 1;
id	text	is_deleted
1	24h	1
set @@tidb_translate_softdelete_sql = true;
drop table message;
create table message (id int primary key nonclustered, text varchar(10)) softdelete retention 7 day;
insert into message values (1, '24h'), (2, '24h'), (3, '1h'), (4, '1h');
delete from message where id = 1;
update message set text = 'new' where text = '24h';
select * from message order by id;
id	text
2	new
3	1h
4	1h
set @@tidb_translate_softdelete_sql = false;
select id, text, _tidb_softdelete_time is not null as is_deleted from message where id = 1;
id	text	is_deleted
1	24h	1
set @@tidb_translate_softdelete_sql = true;
drop table message;
create table message (id int primary key, text varchar(10)) softdelete retention 7 day;
insert into message values (1, 'a'), (2, 'b');
update message set id = 2, text = 'bb' where id = 2;
select * from message order by id;
id	text
1	a
2	bb
drop table message;
create table message (id int, text varchar(10), primary key (id) nonclustered) softdelete retention 7 day;
insert into message values (1, 'a'), (2, 'b');
update message set id = 2, text = 'bb' where id = 2;
select * from message order by id;
id	text
1	a
2	bb
drop table message;
create table t_onupdate (a timestamp(0) on update current_timestamp(0), b int, primary key (a) clustered) softdelete retention 7 day;
insert into t_onupdate values ('2000-01-01 00:00:00', 1);
update t_onupdate set b = 2 where a = '2000-01-01 00:00:00';
Error 1235 (42000): Updating primary key column on soft-delete table is not supported yet
update t_onupdate set a = a, b = 2 where a = '2000-01-01 00:00:00';
select a, b from t_onupdate;
a	b
2000-01-01 00:00:00	2
drop table t_onupdate;
create table t_onupdate (a timestamp(0) on update current_timestamp(0), b int, primary key (a) nonclustered) softdelete retention 7 day;
insert into t_onupdate values ('2000-01-01 00:00:00', 1);
update t_onupdate set b = 2 where a = '2000-01-01 00:00:00';
Error 1235 (42000): Updating primary key column on soft-delete table is not supported yet
update t_onupdate set a = a, b = 2 where a = '2000-01-01 00:00:00';
select a, b from t_onupdate;
a	b
2000-01-01 00:00:00	2
drop table t_onupdate;
create table t_genpk (b int not null, a int as (b % 2) stored, primary key (a) clustered) softdelete retention 7 day;
insert into t_genpk (b) values (1);
update t_genpk set b = 3 where a = 1;
select a, b from t_genpk;
a	b
1	3
update t_genpk set b = 2 where a = 1;
Error 1235 (42000): Updating primary key column on soft-delete table is not supported yet
select a, b from t_genpk;
a	b
1	3
drop table t_genpk;
create table t_genpk (b int not null, a int as (b % 2) stored, primary key (a) nonclustered) softdelete retention 7 day;
insert into t_genpk (b) values (1);
update t_genpk set b = 3 where a = 1;
select a, b from t_genpk;
a	b
1	3
update t_genpk set b = 2 where a = 1;
Error 1235 (42000): Updating primary key column on soft-delete table is not supported yet
select a, b from t_genpk;
a	b
1	3
drop table t_genpk;
create table message (id int primary key, text varchar(10)) softdelete retention 7 day;
insert into message values (1, 'new'), (2, '24h');
update message set id = 3 where text = '24h';
Error 1235 (42000): Updating primary key column on soft-delete table is not supported yet
drop table message;
create table message (id int, text varchar(10), primary key (id) nonclustered) softdelete retention 7 day;;
insert into message values (1, 'new'), (2, '24h');
update message set id = 3 where text = '24h';
Error 1235 (42000): Updating primary key column on soft-delete table is not supported yet
drop table message;
